{
    "po_number": "521793",
    "buyer": "Walmart Inc.",
    "seller": "<Company Name>",
    "order_date": "mm/dd/yyyy",
    "delivery_date": "mm/dd/yyyy",
    "ship_date": null,
    "payment_terms": "Net 18",
    "incoterm": null,
    "port_of_loading": null,
    "port_of_discharge": null,
    "currency": "USD",
    "season": null,
    "items": [
        {
            "style_code": null,
            "style_name": "Men's S/S Crew Tee - Small",
            "color_code": null,
            "color_name": "White",
            "composition": null,
            "size_breakdown": null,
            "total_quantity": 150,
            "unit_price": 3.5,
            "total_price": 525.0
        },
        {
            "style_code": null,
            "style_name": "Men's S/S Crew Tee - Medium",
            "color_code": null,
            "color_name": "White",
            "composition": null,
            "size_breakdown": null,
            "total_quantity": 200,
            "unit_price": 3.75,
            "total_price": 750.0
        },
        {
            "style_code": null,
            "style_name": "Men's S/S Crew Tee - Large",
            "color_code": null,
            "color_name": "White",
            "composition": null,
            "size_breakdown": null,
            "total_quantity": 100,
            "unit_price": 4.0,
            "total_price": 400.0
        },
        {
            "style_code": null,
            "style_name": "Men's S/S Crew Tee - Small",
            "color_code": null,
            "color_name": "Charcoal",
            "composition": null,
            "size_breakdown": null,
            "total_quantity": 150,
            "unit_price": 3.5,
            "total_price": 525.0
        },
        {
            "style_code": null,
            "style_name": "Men's S/S Crew Tee - Medium",
            "color_code": null,
            "color_name": "Charcoal",
            "composition": null,
            "size_breakdown": null,
            "total_quantity": 200,
            "unit_price": 3.75,
            "total_price": 750.0
        },
        {
            "style_code": null,
            "style_name": "Men's S/S Crew Tee - Large",
            "color_code": null,
            "color_name": "Charcoal",
            "composition": null,
            "size_breakdown": null,
            "total_quantity": 100,
            "unit_price": 4.0,
            "total_price": 400.0
        }
    ],
    "total_quantity_all": 900,
    "total_amount": 3350.0,
    "notes": null
}