{
    "po_number": "123456/22",
    "buyer": "FASHION QUEEN",
    "seller": "FASHION ITEMS INC",
    "order_date": "2022-09-22",
    "delivery_date": "2022-09-29",
    "ship_date": null,
    "payment_terms": null,
    "incoterm": null,
    "port_of_loading": null,
    "port_of_discharge": null,
    "currency": "USD",
    "season": null,
    "items": [
        {
            "style_code": "99880052",
            "style_name": "Poshmark black dress",
            "color_code": null,
            "color_name": "BLACK",
            "composition": null,
            "size_breakdown": null,
            "total_quantity": 1,
            "unit_price": 1080.0,
            "total_price": 1080.0
        },
        {
            "style_code": "99881052",
            "style_name": "Waterproof French overcoat",
            "color_code": null,
            "color_name": "BLACK",
            "composition": null,
            "size_breakdown": null,
            "total_quantity": 1,
            "unit_price": 995.0,
            "total_price": 995.0
        },
        {
            "style_code": "99885688",
            "style_name": "Signature perfume",
            "color_code": null,
            "color_name": null,
            "composition": null,
            "size_breakdown": null,
            "total_quantity": 2,
            "unit_price": 205.0,
            "total_price": 410.0
        },
        {
            "style_code": "99884899",
            "style_name": "Classic blazer \"mindsweeper\"",
            "color_code": null,
            "color_name": "RED/BLACK",
            "composition": null,
            "size_breakdown": null,
            "total_quantity": 1,
            "unit_price": 1080.0,
            "total_price": 1080.0
        }
    ],
    "total_quantity_all": 5,
    "total_amount": 3565.0,
    "notes": null
}