{
    "po_number": null,
    "buyer": null,
    "seller": null,
    "order_date": null,
    "delivery_date": null,
    "ship_date": null,
    "payment_terms": null,
    "incoterm": null,
    "port_of_loading": null,
    "port_of_discharge": null,
    "currency": "USD",
    "season": null,
    "items": [],
    "total_quantity_all": 0,
    "total_amount": 0.0,
    "notes": null
}